<?xml version="1.0" encoding="utf-8" ?>
<!-- Interverted sections -->
<orm:QueryList xmlns:orm="http://www.osames.org/osamesorm" xmlns:xsi="http://www.w3.org/2001/XMLSchema-instance" xsi:schemaLocation="http://www.osames.org/osamesorm ../Config/xml_schemas/sqlTemplates.xsd">
  <orm:Updates>  
    <orm:Update name="BaseUpdateOne">UPDATE {0} SET {1} WHERE {2} = {3};</orm:Update>
  </orm:Updates>
  <orm:Inserts>
    <orm:Insert name="BaseInsert">INSERT INTO {0} ({1}) values ({2});</orm:Insert>
  </orm:Inserts>
  <orm:Selects>
    <orm:Select name="BaseRead">SELECT {0} FROM {1};</orm:Select>
    <orm:Select name="BaseReadWhere">SELECT {0} FROM {1} WHERE {2} = {3};</orm:Select>
    <orm:Select name="BaseReadWhereAndWhere">SELECT {0} FROM {1} WHERE {2} = {3} AND {4} = {5};</orm:Select>
    <!-- custom select, read customer with 2 joins -->
    <orm:Select name="ReadSingleCustomer">SELECT {0} FROM {1} LEFT JOIN {2} ON {3} = {4} LEFT JOIN {5} ON {6} = {7} WHERE {8}={9};</orm:Select> 
  </orm:Selects>
  <orm:Deletes>
    <orm:Delete name="BaseDeleteWhere">DELETE FROM {0} WHERE {1} = {2};</orm:Delete>
  </orm:Deletes>
  <orm:ProviderSpecific>
    <!-- SQLite -->
    <orm:Provider xsi:type="orm:DoubleFE" name="System.Data.SQLite" StartFieldEncloser="[" EndFieldEncloser="]">
      <orm:Select name="getlastinsertid">select last_insert_rowid();</orm:Select>
    </orm:Provider>
    <!-- MySQL -->
    <orm:Provider xsi:type="orm:SingleFE" name="MySql.Data.MySqlClient" FieldEncloser="`">
      <orm:Select name="getlastinsertid">select last_insert_id();</orm:Select>
    </orm:Provider>
    <!-- MS SQL -->
    <orm:Provider xsi:type="orm:DoubleFE" name="System.Data.SqlClient" StartFieldEncloser="[" EndFieldEncloser="]">
      <orm:Select name="getlastinsertid">select scope_identity()</orm:Select>
    </orm:Provider>
    <!-- Oracle -->
    <orm:Provider xsi:type="orm:DoubleFE" name="### ORACLE ###" StartFieldEncloser="" EndFieldEncloser="">
    </orm:Provider>
    <!-- SQL Server Compact -->
    <orm:Provider xsi:type="orm:DoubleFE" name="### SQL Server Compact ###" StartFieldEncloser="" EndFieldEncloser="">
    </orm:Provider>
  </orm:ProviderSpecific>
</orm:QueryList>